[
  {
    "monotonic": 11421.772801,
    "hostname": "host01",
    "identifier": "kernel",
    "message": " <TASK>"
  },
  {
    "monotonic": 11422.141663,
    "hostname": "host01",
    "identifier": "kernel",
    "message": " show_stack+0x49/0x60"
  },
  {
    "monotonic": 2.234532,
    "hostname": "host01",
    "identifier": "kernel",
    "message": "Linux version 7.0.0-31-generic (buildd@lcy02-amd64-091) (x86_64-linux-gnu-gcc (Ubuntu 15.2.0-16ubuntu1) 15.2.0, GNU ld (GNU Binutils for Ubuntu) 2.46) #31-Ubuntu SMP PREEMPT_DYNAMIC Sat Aug  1 04:26:38 UTC 2026 (Ubuntu 7.0.0-31.31-generic 7.0.14)"
  }
]
